,id,text
973,1572261170475859973,kelcrocker MrsCHeidrich It may I think publishing IS open theory marginalized voice WOW people push back even heavily sugarcoat reality living w certain disability like Not disability accompanying sadness bullying rejection etc
980,1572259614556835840,maxstaxidermia It come Ward era Tl dr He worker mainly fluff rule maker got cyberbullied even IRL bulling work Also I think something similar happened female artist one Im sure So since GW hide author
984,1572258166980874240,MikeMur SkyNews No bulling Let plea Grandmother funeral Grandchild first British subject second
986,1572257276043620352,McWeex YungstaManic Mate I chilling listening Ahora Te Puedes Marchar bulling lmao You nobody mate
994,1572254243028959232,MubeziLuwaga KingWaiswaMoses MugumeAshraf AllanOkello Good Mediocentro Trident look Not tested though I hope life bulling reckon MugumeAshraf gat lot work complement utter explicit balling discipline
995,1572254219218096129,BlaiseEyong William Kate using THEIR press abuse bulling Meghan n Harry year You tell STOP world wont reason defend
997,1572253341908074496,Kazoo_TV rbbq Right wan na bash hg bulling another bully self
1006,1572248742996353028,Ian Gillan draw attention constant bulling Armenia neighbor http co AlqqsNI Hy
1007,1572248441052450819,ahhh yes perfect heigh Susanoo stop bulling bby http co TBwxv uI
1018,1572241790857793537,Ian Gillan Deep Purple call attention constant bulling Armenia neighbor http co jHFUDGNuUb StopAzeriAggression StopAzerbaijanAggression
1019,1572241492068159488,Y literally bulling people wanting k rn I opinion taking far
1021,1572240986394488834,OCEANS OF MILK AT BORDERWAY The ESPLAND consignment fresh heifer cow tomorrow Border Lakeland sale freshly calved cow amp heifer sell In calf heifer sell bulling amp maiden heifer sell View online catalogue http co yyS ND Q http co kMVVGCUJW
1022,1572239554966614017,razzli_ Have NOTHING TO DO WITH HER COLOR WHICH SHE USES THE BRONZER TO DARKER HER SKIN BUT HER NASTY ATTITUDE AND BULLING
1023,1572239212627255296,LFG I feel like going come back full force bear clear plug bulling http co ksOAL sfy
1025,1572238699911585792,KajolMomento ForumsMeghan If accused bulling child
1026,1572236128492691463,becsfromflecs Sabby_Han HoIdMe_Forever bitchcrafters PennyWHPenelope Stop pretending u really care bulling victim abuse even racism u really show clout nothing else
1031,1572231186122145792,BleacherReport KingJames He look like OLDER James Harden RINGSSSSSSSSS name Kimbo SLICE PRIME When wa back yard BULLING dude HOOKS
1034,1572228617064808450,withempato The dip instability kill Bitcoin turn Bitcoin get stronger people gotten dipping anticipating bulling Chaindustry DoToEarn Bitcoin Crypto
1037,1572225860157214721,BechtloffCarol AngelCiara bennyjohnson You must really enjoy drama bulling name calling FORMER President Trump It shameful year people like still drinking kool aid smoking dope Where sanity
1042,1572223492879437828,ChadEbear TSN MatthewWords BlueJays Horrible horrible comment Matthew Ross ASHAMED Yourself BlueJays bulling meanspirted
1056,1572218322522984448,Are rate competitive natural question running background freelancer brain Stop bulling hour You making enough money constantly stressed thing really affect revenue
1063,1572214483329888256,Ppl bulling tiktok
1064,1572212338089934852,armradio Your tweet wa quoted article armradio http co mwB F EatT
1065,1572212329084772357,armradio Your tweet wa quoted article armradio http co mwB F EatT
1066,1572212319966330881,armradio Your tweet wa quoted article armradio http co mwB F EatT
1069,1572211464953561091,Stop bulling BhanukaRajapak personal belief SriLankan srilankacricket
1070,1572211019795300352,thecasualultra HH SO What everybody clever Celtic support u lot BULLING ROMAN CATHOLICS FOR WHAT Supporting Celtic Club like hh ktf
1072,1572208502105575424,let Fake KKK sec keep bulling american people financially happens get bullied back every piece information particular group posse done intent regulate dominate american dollar infrastructure
1073,1572208489841459202,If I think differently MEEN I wrong meen I think way People think like people Thay always around Start getting around people think differently try understand Bulling work
1086,1572200967067795457,Ian Gillan call attention constant bulling Armenia neighbor http co N pg ZjBcD via armradio
1091,1572192484763095040,In country child safe gun violence sexual predator right racism bigotry hate bulling poverty elected official would anybody want child This country NOT SAFE child live http co VOLMsDwrL
1095,1572191569666609152,Camigon_ evealayo No hagan bulling qcyo del inglishh
1097,1572190915477012480,DanielAndrewsMP How many woman wind person question bulling amp lie
1099,1572189984530075650,Ehioma LeevhuLeaks Who else would dragg gal except please stop defensive one bulling
1102,1572188594885853188,SafrinaMama xylem SussexHenryVIII meghan trash family please explain wa IN front eye way treated interview good speaking torment bulling endure year FIRST
1104,1572185786442817537,jmpousita soi dislexica basta al bulling
1111,1572178441142734848,desquinlivan sprinkle Scanning around simple calf n calf I date min wks event month plus scan externally side crush thus tail day I saw bulling twice last wks n event
1113,1572178278802419712,mhezzy dope_fights_ They bulling boy unprovoked one girl already told truth started
1117,1572176546827309056,Brekkietweets RobBurl How telling truth bulling
1121,1572173348884340736,CVasilenko And maybe remember none u perfect calling wife horrible name woman mother never met would like u calling yo mother name trolling bulling bloody rude Take hate go follow someone else I time U
1123,1572172531142107136,ExileNations Back bulling I see
1127,1572166750720098305,BJP India narendramodi Modi jee wanted strong country cost But internal opposition party bulling But Indian India satisfied PM Becouse PM honest men This know opposition also
1130,1572160873573261313,KittoQuinnzel VTuberTweeter U cant let slide either u need get everyone report bulling amp herasment
1131,1572159271512449028,mollie What awfulness Just give rest grow hell This open bulling need stopped
1132,1572159084329316352,KonstantinKisin I started excited Meghan royal family But really wa lying bulling narcissist celebrity seeking hypocritical behaviour whilst using race card whole convenient cover put She suitable royal life
1159,1572138758761316354,GailMontminy DashTheBaptist As clutch straw asinine comment Parliament siding Her Her husband bulling mistreatment getting especially British Press http co EtPILUS eK
1160,1572137877345112064,moblake Mr_H_aze ADHDfella Not rumor Listen Oprah compare British law Easy proven Bulling wa stated person wa object court Do lie mean About press two wrong make one right
1163,1572132188690292737,also bulling making fun accent bc speak sotho long without adding english phrase heh wethu hope never see
1165,1572128696739463168,NewshubPolitics Get falsehub maybe ask serious question labour bulling minority mp afraid jacinda stop check flowing
1167,1572126889430360066,Even talk shit like bulling rumor hurted learned love
1181,1572121222946734080,Complaining abt negative obsession MM whilst saying disgusting thing abt Royal woman stewps No matter horrible woman make look like massive hypocrite leg stand regard bulling meghanmarkle
1183,1572117630240313345,dreamy bull bulling doggy frick
1189,1572110705666433024,HYPEX I Well Report Cause You Guys Never Check The List Of Guys I Report Too U Hypex On fortinte Yesterday There Was Lot Bulling On Yesrday So What U Guys Gone Bout It
1193,1572104976624914432,Ukraine win war And end dictatorship Russia still trying continue barbaric expansion bulling neighbor three day operation began February turned threat existence Russian regime http co woj qNfAyR http co xSQ NBy VP
1194,1572101372635672577,One muse I miss Ram Rezero enjoy snarky bulling MCe
1197,1572099001830481922,GBNEWS How much money ha Tom Bower made bulling lying prince Harry wife duchess Meghan Tom Bower ha wife I fear A man like men like highly likely Domestic violence abuser
