,id,text
465,1575170784099594252,Blinbich SELSREP bruh hailey done anything continue bully weird asf much HOLD emotion lmaoo
470,1575170667661516800,BBNaija Someone planned Amaka bully attack bryann reason Thank God bryann react day bbnaija
471,1575170662347337736,DiscardedVirtue TimRunsHisMouth He nothing trump His courage nothing bully stance moral conviction acting
472,1575170650875916301,Elizabe tylerperry netflix Willie Earl wa demon drug The way dad encouraged bully Bayou growing wa despicable way disrespected mom wa gut wrenching AJazzmanBlues JazzmanBlues YourFavTvandFilmEnthusiast http co hRaOTlQ
473,1575170606001057792,peaceful_bully What people cancer r going chemo
474,1575170600544669704,Dem bully handler take job seriously http co dyNKYYan E
477,1575170548107444225,SussexvC Let bully Kate She one ha one home live Incidently They belong crown
478,1575170518977638403,I watching cry bully red tail hawk front face called bullying dmons
479,1575170515865841664,Dont ya love take kid park play amp another parent watching kid literally trying bully kid playing playground Cause I one
480,1575170511474028544,Any way anyone want go bully someone drinking olive oil minthe space rn http co OM xqXXbJ
481,1575170505107075075,TheRogue_Elf realDailyWire No It weird I see someone bully judgmental people reason Who care Get new hobby
482,1575170498119364613,thisisacomputah LesbianVictuuri BULLY VIKTOR HE DESERVES IT bc WTF cheap Sebastian Michaelis vibe
486,1575170459535962113,No_ _in_dminor MrAndyNgo Yea It bit left field Certainly isnt representing heritage Getting paid pro grooming bully
487,1575170444906598400,Trirunt chrislhayes Has Tqucums given thought happens back bully nuclear weapon The bully sings land la land land Its land bc people call bluff This US US Patriots deal terrorist
488,1575170421498216449,JustMeRyder Probably yes possible later reopen development Bully remasters GTA IV RDR
489,1575170414073901063,The ourthBranch FenkelSchaefer charliespiering Putin regime imploding He desperate Of course I want WW I also think back attempting bully globe
490,1575170404272185345,Just listening DeSantis He actually sounding like governor instead spoiled brat Or bully
491,1575170352376053762,You stupid bully Nowi
492,1575170337184296960,GeorgeTakei And typical Christian Family Man aka Fragile Male Misogynist BULLY
494,1575170299527458818,PMS_Jordan Helexzura dont like bully method slowly corrupt time
497,1575170290417430538,Dariathatsall literally biggest bully everyone diarrhoea Do speak selena
498,1575170288765267969,TrueNorthCentre PierrePoilievre considered bully year old
501,1575170261518675973,keysparagaa UTDSingh This langur anadoie bully daily basis time file cyber bullying case
502,1575170253159428100,xthekillerannax Oh yes He even talk wa bullied never talked anyone wow look like HE bully
503,1575170218934300672,SkyNewsAust How Canadians Describe Pierre Poilievre leader Opposition Arrogant Bully Dishonest http co qVlUxn
506,1575170194779303936,eggbotme RonFilipkowski It one thing kid wa fun I let kid played pouring rain wanted ran right back wanted This kid obviously hate probably scared instead source comfort mom bully
509,1575170150986240000,genray PapiTrumpo No would boo trump ulcer crowd beat hell bully stand someone like trump baby cry
510,1575170105951940613,I stand wannabe bully quit forcing mean girl act
511,1575170070929899521,BravoTV lisarinna full sh You vile since joining group This rich coming You bully demur victim time
513,1575170023920144386,Destinysraven Not bad dowry BRB gon na bully single buddy buying weed puller
515,1575169994056298496,Guess That Why I On My Bully http co pwMkB qLFJ
517,1575169965115600899,TheFungi tedcruz GregAbbott_TX living Austin I ask every day guess much oil money much land lead masculine arrogance bully mentality
518,1575169955376795648,AmarjeetSohiYEG yes never cease amaze They waving flag much hate We huge bully population bordering hate But rounding victim asking feel maybe spend money
519,1575169931351494656,obefluf Sevastiel Mackiot cassianmoment spellinghardzz JaxKerin ShroomyOllie Soullessartss shootingstar BULLY http co ggtYSSB Xz
521,1575169925131702272,cutegrl bald ALWAYS choice
526,1575169857171378176,noprojector believe matching tattoo bully
528,1575169803761111041,peaceful_bully I hate bald people choose bald
529,1575169761599582213,lrt read really funny especially turkiye bully UK lmao
530,1575169756222484483,PLEASE DON T BULLY ME BUT DO ANY OF YOU GUYS SEE IT TOO http co nYgVCU ed
531,1575169729127280640,cutegrl feel sorry
533,1575169724815937536,bully call bunny like everyday compared talking irony lack career growth despite skill attitude
534,1575169707472089091,Bullying affect everyone bullied bully witness bullying furthermore accordingly StopBullyingGov bullying linked whole host negative outcome including impact mental health substance use suicide
535,1575169704502521862,The mother bully ha informed child behavior quote quote mOrTiFiEd Yet quite mortified enough reach parent bullied
536,1575169702913245184,Yet perhaps worst incident wa bully air dropped beautiful friend repulsive racist image included n word Hey white parent kid
538,1575169701344608256,The incident continuous including bully man handling friend threatening jump gang kid making disparaging comment Nike Pride gear
541,1575169673263718400,JalinTurner Weight bully
542,1575169663620640775,RepMTG HuffPost Three toe dish take Typical action bully support trump committed espionage
543,1575169654326431744,dayoisrael Nobody bully u bring without brain I reset wotowoto u anyhow u see anyhow I campaign asiwaju full chest stand I dey wait una
544,1575169613557428231,ONLY ALLOWED TO BULLY THE VAN WHERE THE ONLY PERSON INSIDE US
546,1575169581844295680,cliddle ripeacsky punished_stu You bully deez nutz
547,1575169579885555712,Mollyploofkins Typical Bully type He everything could NEVER decent person And understands government
549,1575169573179236352,I actually tell like hate But perspective seems like hate like fact someone bully disrespect
553,1575169560893747200,QBZ Bully combo Ooooofff http co W FmEutVuG
554,1575169554007076867,peaceful_bully I FUCKIG HATE BALD PEOPLE
555,1575169539813146624,Ron DeSantis ha finally found something bully submission
557,1575169531924062209,PossiblePussy Bully fun
559,1575169507571560451,youngbucksclub So hope great week I argue bully NOONE
560,1575169492619264000,HekateBlack Bully hard nut
562,1575169455784857600,cutegrl admit like bald guy already
564,1575169429172015104,xiaozuhq Why u bully
565,1575169422494298116,GarbageApe When liberal find Italian fascism mostly crushing poor relieved Hitler ha bully Mussolini going along Jew stuff
567,1575169375925325824,anyone want get drunk listen Hawthorne Heights
568,1575169371441602560,I undertstand people bully others feel better actually make horrible person
569,1575169354039459840,I Childe bully And I became prisoner Momiji Dyed Court month http co Nb riNQ
571,1575169347059740673,There lot dense obtuse conversation going regarding HBCU PWI thing I personally seen anyone TL attack bully lady team
576,1575169257796956160,VasCityEstates friend dan foch bully bruh girl dad laughable care get bullying woman http co oKMoOFEVa
577,1575169250192687104,hehemonu Friends bully ig
578,1575169242898759681,_AllanNgash polo_kimani aii muambie bully
579,1575169233998467073,Never let prospect try bully around They one coming problem They way kick rock respectfully
580,1575169216051027969,When Moms Liberty want banbooks bully teacher otherwise delegitimize experience life child parent I ready take action This past week signature garnered petition asking Town EastFishkill http co jYojt v
583,1575169205803970567,lxstlosty Remind invaded Ukraine Yup dealing bully best thing turn around spread butt cheek At time keep sucking Putins propaganda might well go
584,1575169187970154496,poloandsons Kerr ignorant gammon typical bully The type requires lesson sure real world would quickly teach step sphere
585,1575169168801820673,I never planned getting attached bitch I named Rice Pudding cause I wa hungry I started playing I deep He one baby top OCs I think every day want bully cause deserves http co gqJUHP JSt
586,1575169163936825344,such_hockey_wow AITA_online I nose ring year I asked work environment I management still nothing nose ring This lady bully
587,1575169163340836871,Hahahahaha It much fun bully
591,1575169125042647046,katienicholl nbc TODAYshow Interesting Katie dont year old boy bully today Don bother suck know exactly Are aware abuse hurled child despicable
592,1575169123549474816,The people arguing defend Li clearly give sht L making positive L controversy A man stood friend ex band mate Encouraged bully better better apologize The fact ripping apart sad
593,1575169117442568201,PerformOrResign NikkiBar renoomokri If wa one answered like cry cyber bully
594,1575169107611488261,TamiTheBlub Helexzura Tami need bully play u
595,1575169074241237001,Annie_Bannany akdeb DesignO JFG AmoneyResists latimes Design Never waste Got ta push back receipt When block run people see stand bully nonsense
596,1575169062455242753,taking care shih tzu hair much stressful pitbull american bully
597,1575169039147495441,bully http co B cXbbaFi
600,1575168987570139145,ravelesm Yup dealing bully best thing turn around spread butt cheek At time keep sucking Putins propaganda might well go
601,1575168967169417217,The joke called obviously poor taste insecurity always laid bare overreaction Make mistake Twitter powerless people come bully perceive powerful Now wa referring Bajan white http co z l IhGzvJ
602,1575168950304149505,RebelNews_CA RebelNewsOnline I see mega troll bully Car yma Saad sad
603,1575168905961566220,Yolitatennis Unfortunately often like typical reaction someone wa bullied Instead knowing mean feel tend bully others feel better
605,1575168885648551943,KarenCraneofCA KLCRynearson You exactly right She denies hateful bullying She blame target instead bully In instance ha become bully face tell back She ha power Her word mean nothing say position self centered
607,1575168849644855296,You loss fame Wimme game fake Forwards One bully son growing goff twinger read Nazi Priers
611,1575168749358809095,rositasalvaj GroovyCrafts tssweetlt RaeluvBlueGreen killmyhabit Imma go coz obviously use arguing yall wan na shift topic bully u
613,1575168739057598470,LPNational Or maybe stop Capitalist Imperial Bully close foreign military installation bring military back US exception naval patrolling scattered air support ally needed Propose anything else hypocrite
615,1575168717121388557,ThemanShola Honestly twitter filled bitter people insult people easily twitter much dragging bully ng
618,1575168642097872906,RonFilipkowski Being popular bully two different thing
619,1575168633168596995,please bully eat
620,1575168632904044544,From thrashed Kevin McCarthy excellent Michelle Obama A bully always coward The Old Siren
623,1575168548820746248,charlhennessy He hiding tweet Charl He coward bully
624,1575168519620001792,Much U handle Glock_Topickz It made psychotic fan base bully poor girl time grieving wa horrendous She shut tf
625,1575168517690621956,That try bully shit dont work bitch I big dog
627,1575168466717376512,How bully learns share Please check fun child book Gim Jimmy BookBuz http co kvWrX KG W
628,1575168457167220736,NickAdamsinUSA So little bully beat girl Paramilitary jackass wa afraid someone stealing gun obtained illegally trained needed start killing http co LjYSk kGiI
630,1575168412040409088,When gon na get tbp bully ship thinker account
631,1575168406168678400,JamesMelville Why would anyone right mind watch someone destroy infrastructure need people give money people expensive resource Sounds like bully play Time Germans fire nuclear power plant
634,1575168332000821248,I need someone bully lifting heavier bc I know I I
638,1575168300144656385,TimRunsHisMouth A masterclass arrogant rude bully Wonder studied
640,1575168277000880129,Time bully http co EWgUG F Uu
641,1575168272558850052,Your high school bully streaming soon
642,1575168268679413761,dazeydreamy Can collectively bully one gave george ahegao hoodie
643,1575168263763263490,SteveWilkosTV bully I hope Karma meet
645,1575168250727366669,DonaldJTrumpJr Listen jr I auto immune disease issue I get vaccination Right I really go anywhere except appointment My family also wear mask everywhere Don bully people wearing mask
646,1574919485420716033,im bullyed
647,1574834958400720906,calling michael scary know wa bullyed father bc nose appearence since wa kid amp kind thing affect person think speak
648,1574765831438979072,The kid bullyed school using http co QagMo uTEE
649,1574589837994246153,yes vile woman trash hated support anything ok bullyed country dem trash vile woman group support u shut get mic stop bully text four see way
650,1574563990688370688,man bullyed friend man colored get cool person canceled http co rO ek b
652,1574257153614831616,JoshuaHeck TommyShrimps That good one ever bullyed I platform year site I part
654,1574168919002284033,DeathMoonKiller I bullyed lol
655,1574078314305683457,dbzrevengerbx Thank I get bullyed I get bullied D
656,1573768655220998148,Me n TheJaelonJones really bullyed way b traffic
657,1573696004439920640,chill brother back home making fun harassing It sure wont trigger ptsd back school got bullyed DDDDD
658,1573474669990125570,MwangoCapital How family ever pay grabbed bullyed acquire
659,1573440575726145566,sophielouisecc power put manifesto general election like party The party power release budget let honest fuck everyone dosent earn year tweet culture war bullshit party bullyed end
660,1573402149823938583,ill listen rush hour read taekook harry potter au wont get bullyed exposed even http co evhPZ
661,1573373740267999233,TehVilly bet bc people bullyed saying useless
662,1573305874822860800,im constantly getting bullyed school
663,1573129517899853824,Bullyed Me house KNOW TONY PAYING FULL RENT BEING ME NOT THEM WHOLE GETTING DISRESPECTED BYE MY OWN OTHERS NOT NUN FAMILY WATCHED
664,1573119223173648384,svdate Can imagine ever president There biggest resignation American history All depts bullyed amp blasted No one work FBI DOJ NA IRS And many
665,1573098149803360256,p _ Am I getting bullyed right http co rPDWB h E
666,1572938474667360256,get cyber bullyed mannn wa school wa survival fittest
667,1572763545842126849,wa getting bullyed prison life
668,1572604452494004224,formularacers_ Even bad Kmag lately Mick still beat point still bullyed qualifying Idk people standard rookie right
669,1572434991912734720,DieWithU_ Dude ugly fat make horrible bitch act course judge woman like Madonna You desperate I understand little monster bullyed need feel people love
670,1572328143792513024,highimallyy legend never die Juice wrld forev ally appreciate juice music much ha helped much year dealing sadness bullyed everytime listen heart heals quickly
671,1572310293761429504,afterlyfe BladeTheAlt Not anyones side I got bullyed never Ignore people bully
672,1572304591756349440,Ellie_notafurry spell bullied wrong spell bullyed haha
676,1572263867660767234,I sick bullying MeghanMarkIe people find anything matter small pointless use ammunition It make ashamed British Stop horrible snob
679,1572263839764480000,HunterBiden needPS uoregon But Mormons get mad make saying better People realize Just one kid retaliate le bullied another kid make bullying acceptable towards kid I believe understand still
680,1572263834945032193,DJRoyVon JNH A solid year worth good honest bullying whilst adolescence would eradicated potential banal tweet He clearly beyond help
686,1572263756402663424,oopooppiqiq bullying
694,1572263640216080385,literally complain people bullying game thing hypocritical
696,1572263598734381057,George_T_Truth Anna__with_an_A What use UK Charities Mental Health Anti Bullying since person still face confirmed bully Evidence people see
697,1572263597111185410,realBobbyHealy I wonder like working homophobic bullying dictator engages questionable offshore money laundering regularly us disinformation suit end lie death count becomes deranged anyone opposes
699,1572263583131799552,RejiYates rebecca_sussex People NEVER met Queen knew cried funeral Meghan wa part family yet cry Bullying anyone cry funeral deserves straight hell award
705,1572263567335768066,Bullying claim made majority complaint Scotland councillor last year new report ha shown http co oyIeKfIzLQ
706,1572263563728932865,smolcaspy oh wow thought boy th grade bullying inviting hike j
714,1572263490684948483,the_P_God Bullying never left
716,1572263482225197059,Holly Phil clearly job people job must one bullying I time watch ThisMorning week never mind every day evil moment BeKind
717,1572263467641454593,Lets see Q ha died many Commonwealth country want You NO connection aristocracy aka RF proof Meghan lying bullying I wa raised UK raised tell truth truth hurt bad http co EDzZJJhElU
721,1572263408698785794,I suppressed emotion since schooldays Showing led bullying I word truly express bubbling within Pure fury hatred rich people friend dubious funding intent destroying u
723,1572263406597455875,bigdumb_baby Bring back bullying
724,1572263403661533187,Where im bully get bullied bullying
726,1572263391389167618,They better put heat bullying quarter doc http co pDw ODowCn
729,1572263377594093569,SiggyStardust Good grief timeline full disrespect hate bullying Had enough BS Reported blocked
730,1572263368471318532,What defending injustice I part mob I attack anyone It often way bully pretend behaviour service prevention bullying You reason come I think bully Julia http co jnc WKyUa
737,1572263247398445056,Belle I hatred RF whatsoever NONE I hatred hatred targeted bullying
739,1572263219871510528,neopaean Hockeystix e adan BeratStuff People peanut gallery tend attack easy target make feel better Internet bullying sad And I wish bully ha better day instead trying harm others
748,1572263151202357252,mygines like bullying
753,1572263123851317249,publicly bullying know feeling
768,1572262962542579713,SIXMARBLES_ Stop bullying wtf http co OZcWXYAtdH
769,1572262962324475905,raycondones I tell main stream medium sport medium bullying Kyrie Irving wrong take time talk fan hour night one time NBA even started yet doe sound crazy wrong
786,1572262882762706945,If employer truly wanting improve retention rate need first amp foremost get serious addressing dysfunctional toxic organizational culture give rise bullying amp workplace abuse http co yenZZnA T
795,1572262791222038530,Beno_ldn Bullying You mean reporting truth
799,1572262750688083968,MeghanMcCain All DeSantis stand bullying weak He ha interest actually helping country
807,1572262663744524288,Who bullying Prismo
813,1572262615631659012,doglover ithoughtwhatidd BigDongDeSantis DeAngelisCorey reason important kid taught ok grow becoming bigot bullying kid might gay
814,1572262614805401602,Logically_JC I sick tired bullying threat maga cult world They trying intimidate majority America BS need stand lawlessness
818,1572262572556169217,You bullying I really help You interrupting I really defend presence You seeking harmful dangerous attention I one losing relationship looked violent I reaction mode
819,1572262572270956546,like rd episode minho bullying everyone http co ZaaQr XAgP
821,1572262550657441792,Nanaakua Seen clip woman GBNEWS nasty spiteful like Dan Wootton hating MeghanMarkIe toxicity grown people display shocking They like school child playground bullying people like
830,1572262517610786816,seven__ Meghan ha BULLIED year including recently funeral period Yes actor actress human Yes actor actress CRY SOMETIMES IN REAL LIFE Yes Meghan IS HUMAN Yes hater think bullying pleasure wa robot MONSTERS http co C H ZO
832,1572262499784818690,DoZeVT Who want sfw art sheep bullying http co RNJWQiRJa
843,1572262365596352516,know fucked cyber bullying The fact alone could comment someone post bullying point sobbing telling good wan na kt beyond disgusting get life
847,1572262331182370817,mommaqueer njerrbearr Why bullying minor
848,1572262328992686080,furbabygirl I feel sick I see people like constantly bullying whilst making excuse vile old bat Maureen Lipman
849,1572262321250250753,MikeSington RealDeniseWelch Kudos pointing disgraceful mean bullying behaviour Prayers Prince Harry Meghan
859,1572262220586778624,BvlgariDiamond AgathedeLili I guess bullying Meghan Markle excuse Duchess Suxess It must pay well
861,1572262194653396992,BB_Updates I would love see Monte pick Turner take final Turner win final take Taylor Turner reason Early season I spoke bullying namely one person constantly target abuse I choose Taylor strength shes shown
866,1572262168934125568,JuliaHB spain Why brit That bullying Go elsewhere I say let give money
872,1572262075040436226,What adult bullying address http co b r YB uWB mentalhealth mentalillness http co QZ MQnEkMs
875,1572262059370491908,Today MeghanMarkIe accused check note fake cry Queen funeral Honestly I totally see Harry wanted get away tbh bullying queensfuneral
881,1572262032405037056,The fact Meghan said wanted take life due bullying got people still teasing
882,1572262019356852224,KayBurley jamesmurray_ldn country wa polling republican May wa long serving widely respected monarch passed Are British going talk like grown ups going shouted bullying medium http co HhffNQcnVR
886,1572261954210910209,Reminds back high school I would actively ignore rumor twist positive twist break chain A single person actively helping victim type bullying make hell difference stopbullying http co DnnXgR rUa
893,1572261911831674880,JennerBetty Dominos_UK Bullying queue jumping kid groomer n sidekick Get grip Betty
894,1572261908530487298,LizKershawDJ Hmm huge backlash amp rightly bullying tweet Thinking deleting yet
895,1572261905032675328,GBNEWS GBNEWS assume supportive ongoing female bullying vile Dan Wootton The evidence suggests
896,1572261903828922368,Jasonngoose philliphaydon BaconHer aurorachaang Knowledge power appear quite weak subject amazing obsessed trolling bullying Taiwanese least month I seen
897,1572261869456625665,Javale McGee ha le ring Shaq lol I guess bullying worked landing good basketball situation
901,1572261844236267521,MargKezSmith ArchRose Bullying Where f get
905,1572261826988998656,DailyMailUK It getting beyond acceptable This nothing bullying It need stop
908,1572261775864893440,according _taz JamesAndrewLDN Anybody support pathological LIARS like H amp Mwho spread allkinds LIES destroy family raised earn lot amp play victim card NEEDS professional help ASAP H amp M NOT innocent victim BIGGEST BULLIES planet BULLYING RF
909,1572261775319437313,AnnaB A follow masterclass bullying manipulation lying covering truth
913,1572261718297804801,punk_indiemama TabbyCattitude BobNethaway TvKhaleesi But palace ha Bullying investigation report kept close wrap If dare tell serious fib lie roasted I sure guilty
917,1572261688900227072,Scilla__X Zeeezee__ hmm lena went twitter insert justin told fan stop bullying sofia richie gf time concern
918,1572261680729432064,beatspm itsnursepenny Healtcare professional Educator And round awesome person calling prejudice discrimination bullying ageism sexism Great work Nurse Penny Thanks linking u x
919,1572261654284406785,like u see bullying ppl ripe decaying age please actually bully come deactivate
920,1572261651587670016,Meghan Markle Here history sh taken British press public http co Lil QkpwQ via stylistmagazine
923,1572261622709915651,DonPayne BlakelyAdrian I see bullying writ large stronger forcing weaker
926,1572261585183440896,StevenJonMiller GBNEWS I agree I think need left alone Princess Diana wa hounded like look wanted happen Memories short stop bullying let get life Andrews one need sorted forget done
928,1572261555873681409,But people recorded struggling posted online Incentivizing working reward issue bullying fucking kid And post struggling online That fucked change mind
932,1572261519433535490,Sometimes got ta show ho pussy bullying shit let tell sum BITCH Ian going nunna
936,1572261499745472513,I stop bullying
942,1572261437980160000,Merryweatherey aptx Merrydawg Anytime someone start something I heard apparently I immediately think proof If heard something someone known pushed socially time likely contributing bullying ESPECIALLY high school
948,1572261384607637506,PaulRoss Fully agree The relentless bullying humiliating leak smearing embarrassing medium still treat person like even happened past
949,1572261382078472192,MetroUK Can nation get grip anyone would think committed murder way people piling bullying That shameful bit social medium cesspit hate time
950,1572261376554598401,MariaMalou NileGardiner JamieBrysonCPNI Indeed No Biden impertinent interference No EU bullying No work perfectly
951,1572261376361467907,yr old Daughter Fuck boy They smell stupid mean amp make fucking mad I swear I going punch one boy school face say one thing Me Is bullying Daughter No keep telling great Trump
952,1572261368644141057,Bring back bullying http co RQ IMHcZd
953,1572261364508262402,realJonRiley detectiv RockstarGames You concerned video game effecting people mental issue concerned stem Bad childhood Bullying school Drugs Pressured making bad decision
963,1572261269939560449,Rohit bullying DK
969,1572261239564439552,stan twt think need bring back bullying http co VjmzQpDWmz
971,1572261216881635331,peachesmama billyballrot sunflowergolbch DionneGrant TiffanyAndCo To This serious problem TO YOU And seriously think bullying trans kid better Threatening bomb kid beating different YOUR KIND problem Not u So piss
